{
  "sourceFile": "/Users/kawata/shyme/zasso/crates/siprs/RFC-ROOT.md",
  "mainLanguage": "rust",
  "nodes": [
    {
      "id": "N0001",
      "title": "§1 目的 — 本crateの責務定義",
      "kind": "architecture",
      "summary": "RustからPJSUAを安全かつ非同期に利用しSIP音声通話機能を提供するcrateの目的を定義。映像機能は対象外。",
      "language": "rust",
      "slug": "purpose",
      "headingRefs": [
        {
          "refId": "REF177",
          "heading": 2,
          "texts": [
            "1. 目的"
          ]
        }
      ]
    },
    {
      "id": "N0002",
      "title": "§1a M20実装優先度マップ",
      "kind": "requirement",
      "summary": "M20追補の全実装項目をP0/P1/P2/P3優先度で整理。NativeEvent変換・RuntimeCommand整備・SubscribeAudio等。",
      "language": "rust",
      "slug": "m20_priority",
      "headingRefs": [
        {
          "refId": "REF178",
          "heading": 2,
          "texts": [
            "1a. M20 実装優先度マップ"
          ]
        }
      ]
    },
    {
      "id": "N0003",
      "title": "§1a 設計判断対応表",
      "kind": "rationale",
      "summary": "M20設計判断Q1:A〜Q14:Aの一覧。各IDの意味と該当セクションを参照する対応表。",
      "language": "rust",
      "slug": "design_decisions",
      "headingRefs": [
        {
          "refId": "REF179",
          "heading": 4,
          "texts": [
            "設計判断対応表"
          ]
        }
      ]
    },
    {
      "id": "N0004",
      "title": "§2 非目的",
      "kind": "architecture",
      "summary": "本crateが提供しない機能一覧（SIPサーバ、PBX、映像処理、録音ファイル等）。",
      "language": "rust",
      "slug": "non_goals",
      "headingRefs": [
        {
          "refId": "REF180",
          "heading": 2,
          "texts": [
            "2. 非目的"
          ]
        }
      ]
    },
    {
      "id": "N0005",
      "title": "§2.1 Tauri統合との責務境界",
      "kind": "architecture",
      "summary": "crateはTauri非依存。Rust公開API提供に責務を限定。",
      "language": "rust",
      "slug": "tauri_boundary",
      "headingRefs": [
        {
          "refId": "REF181",
          "heading": 3,
          "texts": [
            "2.1 Tauri（フロントエンド）統合との責務境界"
          ]
        }
      ]
    },
    {
      "id": "N0006",
      "title": "§3 用語",
      "kind": "glossary",
      "summary": "Client/Account/Call/MediaSession/Source/ChunkPair/RawSIPEventの用語定義。",
      "language": "rust",
      "slug": "glossary",
      "headingRefs": [
        {
          "refId": "REF182",
          "heading": 2,
          "texts": [
            "3. 用語"
          ]
        }
      ]
    },
    {
      "id": "N0007",
      "title": "§4 準拠要件",
      "kind": "requirement",
      "summary": "MSRV 1.95以上、PJSIP 2.17固定、tokio唯一の非同期ランタイム。Windows/macOS/Ubuntu。",
      "language": "rust",
      "slug": "compliance",
      "headingRefs": [
        {
          "refId": "REF183",
          "heading": 2,
          "texts": [
            "4. 準拠要件"
          ]
        }
      ]
    },
    {
      "id": "N0008",
      "title": "§4.1 バージョニングポリシー",
      "kind": "api_contract",
      "summary": "0.xはsemver非厳密、1.0以降は厳守。#[non_exhaustive]でSipEventPayload拡張許容。",
      "language": "rust",
      "slug": "versioning_policy",
      "headingRefs": [
        {
          "refId": "REF184",
          "heading": 3,
          "texts": [
            "4.1 バージョニングポリシー"
          ]
        }
      ]
    },
    {
      "id": "N0009",
      "title": "§5 機能要求の確定化",
      "kind": "requirement",
      "summary": "複数アカウント・動的追加削除・UDP/TCP/TLS・ICE・PCMU/Opus・DTMF3方式・イベントバス等15項目。",
      "language": "rust",
      "slug": "requirements_scope",
      "headingRefs": [
        {
          "refId": "REF185",
          "heading": 2,
          "texts": [
            "5. 機能要求の確定化"
          ]
        }
      ]
    },
    {
      "id": "N0010",
      "title": "§6 全体構成",
      "kind": "architecture",
      "summary": "siprs/srcのモジュール構成図。lib/audio/ffi/runtime/util/vendor配置。",
      "language": "rust",
      "slug": "module_structure",
      "headingRefs": [
        {
          "refId": "REF186",
          "heading": 2,
          "texts": [
            "6. 全体構成"
          ]
        }
      ]
    },
    {
      "id": "N0011",
      "title": "§6.1 Crate責務分割方針",
      "kind": "rationale",
      "summary": "単一crate選択理由：PJSIP密結合・通話とメディア不可分性。将来分割可能性。",
      "language": "rust",
      "slug": "crate_responsibility",
      "headingRefs": [
        {
          "refId": "REF187",
          "heading": 3,
          "texts": [
            "6.1 Crate 責務分割方針（設計判断）"
          ]
        }
      ]
    },
    {
      "id": "N0012",
      "title": "§7 並行性モデル",
      "kind": "architecture",
      "summary": "単一core reactor threadですべてのpjsua_*をシリアライズする設計概要。",
      "language": "rust",
      "slug": "concurrency_model",
      "headingRefs": [
        {
          "refId": "REF188",
          "heading": 2,
          "texts": [
            "7. 並行性モデル"
          ]
        }
      ]
    },
    {
      "id": "N0013",
      "title": "§7.1 実行コンテキスト",
      "kind": "architecture",
      "summary": "User async/Core reactor/PJSIP callbacks/AudioWorkerTasksの4コンテキスト。",
      "language": "rust",
      "slug": "execution_contexts",
      "headingRefs": [
        {
          "refId": "REF189",
          "heading": 3,
          "texts": [
            "7.1 実行コンテキスト"
          ]
        }
      ]
    },
    {
      "id": "N0014",
      "title": "§7.1a 単一Reactorスケーラビリティ注記",
      "kind": "rationale",
      "summary": "〜30同時通話まで十分。大規模時グループ分割検討。PJSIP制約。",
      "language": "rust",
      "slug": "reactor_scalability",
      "headingRefs": [
        {
          "refId": "REF190",
          "heading": 3,
          "texts": [
            "7.1a 単一Reactorのスケーラビリティ注記"
          ]
        }
      ]
    },
    {
      "id": "N0015",
      "title": "§7.2 command serialization",
      "kind": "api_contract",
      "summary": "RuntimeCommand enum定義。unbounded MPSCでReactorへ送信。",
      "language": "rust",
      "slug": "command_serialization",
      "headingRefs": [
        {
          "refId": "REF191",
          "heading": 3,
          "texts": [
            "7.2 command serialization"
          ]
        }
      ]
    },
    {
      "id": "N0016",
      "title": "§8.1 crateルート公開API",
      "kind": "api_contract",
      "summary": "lib.rsからのpub use再公開一覧。",
      "language": "rust",
      "slug": "crate_root_api",
      "headingRefs": [
        {
          "refId": "REF192",
          "heading": 3,
          "texts": [
            "8.1 crate ルート"
          ]
        },
        {
          "refId": "REF_PARENT_N0016",
          "heading": 2,
          "texts": [
            "8. 公開 API 設計"
          ]
        }
      ]
    },
    {
      "id": "N0017",
      "title": "§8.2 SipClient構造体",
      "kind": "api_contract",
      "summary": "Arc<ClientInner>の薄いハンドル。RuntimeHandle/EventBus/RwLock/shutdown。",
      "language": "rust",
      "slug": "sipclient_struct",
      "headingRefs": [
        {
          "refId": "REF193",
          "heading": 3,
          "texts": [
            "8.2 SipClient"
          ]
        }
      ]
    },
    {
      "id": "N0018",
      "title": "§8.3 SipClient APIメソッド",
      "kind": "api_contract",
      "summary": "new/subscribe/各subscribe/add_account/remove_account等の全シグネチャ。",
      "language": "rust",
      "slug": "sipclient_methods",
      "headingRefs": [
        {
          "refId": "REF194",
          "heading": 3,
          "texts": [
            "8.3 SipClient API"
          ]
        }
      ]
    },
    {
      "id": "N0019",
      "title": "§8.4 SipAccountHandle API",
      "kind": "api_contract",
      "summary": "id/register/unregister/registration_state/make_call/update_config。",
      "language": "rust",
      "slug": "account_handle_api",
      "headingRefs": [
        {
          "refId": "REF195",
          "heading": 3,
          "texts": [
            "8.4 SipAccountHandle API"
          ]
        }
      ]
    },
    {
      "id": "N0020",
      "title": "§8.5 OutgoingCallRequest",
      "kind": "api_contract",
      "summary": "OutgoingCallRequestとCallMediaPreferences構造体。PCMU/Opusのみ承認。",
      "language": "rust",
      "slug": "outgoing_call_request",
      "headingRefs": [
        {
          "refId": "REF196",
          "heading": 3,
          "texts": [
            "8.5 OutgoingCallRequest"
          ]
        }
      ]
    },
    {
      "id": "N0021",
      "title": "§9 ID設計",
      "kind": "data_model",
      "summary": "NonZeroU64ベースnewtype。BiMap<RuntimeId, NativeId>で変換。",
      "language": "rust",
      "slug": "id_design",
      "headingRefs": [
        {
          "refId": "REF197",
          "heading": 2,
          "texts": [
            "9. ID 設計"
          ]
        }
      ]
    },
    {
      "id": "N0022",
      "title": "§10 ClientConfig完全仕様",
      "kind": "config",
      "summary": "clientConfig全フィールド定義。user_agent/log_level/max_calls等。",
      "language": "rust",
      "slug": "client_config",
      "headingRefs": [
        {
          "refId": "REF198",
          "heading": 2,
          "texts": [
            "10. ClientConfig 完全仕様"
          ]
        }
      ]
    },
    {
      "id": "N0023",
      "title": "§10.1 既定値",
      "kind": "config",
      "summary": "Default実装値。max_calls=32, event_bus_capacity=2048等。",
      "language": "rust",
      "slug": "config_defaults",
      "headingRefs": [
        {
          "refId": "REF199",
          "heading": 3,
          "texts": [
            "10.1 既定値"
          ]
        }
      ]
    },
    {
      "id": "N0024",
      "title": "§11 AccountConfig完全仕様",
      "kind": "config",
      "summary": "AccountConfig構造体全フィールド定義。認証・ドメイン・トランスポート設定。",
      "language": "rust",
      "slug": "account_config",
      "headingRefs": [
        {
          "refId": "REF200",
          "heading": 2,
          "texts": [
            "11. AccountConfig 完全仕様"
          ]
        }
      ]
    },
    {
      "id": "N0025",
      "title": "§11.1 validation rules",
      "kind": "config",
      "summary": "AccountConfigのvalidation rules。必須フィールド・不整合検査。",
      "language": "rust",
      "slug": "account_validation",
      "headingRefs": [